### ISSUE TITLE
dhcpcd:  fails to acquire an IPv4 address

### ISSUE THREAD

**Issue by deepfire** [NixOS/nixpkgs#283628]
### Describe the bug

This is already tracked upstream: https://github.com/NetworkConfiguration/dhcpcd/issues/281

The client fails to acquire the DHCP-server-supplied IP address, which looks in the logs as follows, repeated ad infinitum:

```
Jan 25 03:23:02 host dhcpcd[14323]: eth0: dh:cp:se:rv:er:mc(dh:cp:se:rv:er:mc) claims 1.2.3.4
Jan 25 03:23:02 host dhcpcd[14323]: eth0: dh:cp:se:rv:er:mc(dh:cp:se:rv:er:mc) claims 1.2.3.4
Jan 25 03:23:02 host dhcpcd[14323]: eth0: 10 second defence failed for 1.2.3.4
Jan 25 03:23:02 host dhcpcd[14323]: eth0: deleting route to 1.0.0.0/8
Jan 25 03:23:02 host dhcpcd[14323]: eth0: deleting default route via 1.0.0.1
Jan 25 03:23:02 host dhcpcd[14323]: eth0: rebinding lease of 1.2.3.4
Jan 25 03:23:02 host dhcpcd[14323]: eth0: probing address 1.2.3.4/8
Jan 25 03:23:07 host dhcpcd[14323]: eth0: leased 1.2.3.4 for infinity
Jan 25 03:23:07 host dhcpcd[14323]: eth0: adding route to 1.0.0.0/8
Jan 25 03:23:07 host dhcpcd[14323]: eth0: adding default route via 1.0.0.1
Jan 25 03:23:08 host dhcpcd[14323]: eth0: dh:cp:se:rv:er:mc(dh:cp:se:rv:er:mc) claims 1.2.3.4
Jan 25 03:23:08 host dhcpcd[14323]: eth0: dh:cp:se:rv:er:mc(dh:cp:se:rv:er:mc) claims 1.2.3.4
Jan 25 03:23:08 host dhcpcd[14323]: eth0: 10 second defence failed for 1.2.3.4
Jan 25 03:23:08 host dhcpcd[14323]: eth0: deleting route to 1.0.0.0/8
Jan 25 03:23:08 host dhcpcd[14323]: eth0: deleting default route via 1.0.0.1
Jan 25 03:23:08 host dhcpcd[14323]: eth0: rebinding lease of 1.2.3.4
Jan 25 03:23:08 host dhcpcd[14323]: eth0: probing address 1.2.3.4/8
Jan 25 03:23:14 host dhcpcd[14323]: eth0: leased 1.2.3.4 for infinity
Jan 25 03:23:14 host dhcpcd[14323]: eth0: adding route to 1.0.0.0/8
Jan 25 03:23:14 host dhcpcd[14323]: eth0: adding default route via 1.0.0.1
```

Meanwhile, on the wire we see the following:

```
02:52:41.370524 IP 0.0.0.0.bootpc > 255.255.255.255.bootps: BOOTP/DHCP, Request from cl:ie:nt:ma:ca:dr (oui Unknown), length 337
02:52:41.371083 IP server.bootps > 1.2.3.4.bootpc: BOOTP/DHCP, Reply, length 308
02:52:47.583527 IP 0.0.0.0.bootpc > 255.255.255.255.bootps: BOOTP/DHCP, Request from cl:ie:nt:ma:ca:dr (oui Unknown), length 337
02:52:47.584122 IP server.bootps > 1.2.3.4.bootpc: BOOTP/DHCP, Reply, length 308
02:52:53.508164 IP 0.0.0.0.bootpc > 255.255.255.255.bootps: BOOTP/DHCP, Request from cl:ie:nt:ma:ca:dr (oui Unknown), length 337
02:52:53.508768 IP server.bootps > 1.2.3.4.bootpc: BOOTP/DHCP, Reply, length 308
02:52:58.902490 IP 0.0.0.0.bootpc > 255.255.255.255.bootps: BOOTP/DHCP, Request from cl:ie:nt:ma:ca:dr (oui Unknown), length 337
```
..which, upon close inspection is:
```
02:55:26.811461 IP (tos 0x0, ttl 64, id 8452, offset 0, flags [none], proto UDP (17), length 365)
    0.0.0.0.bootpc > 255.255.255.255.bootps: BOOTP/DHCP, Request from cl:ie:nt:ma:ca:dr (oui Unknown), length 337, xid 0x87654321, Flags [none]
	  Client-Ethernet-Address cl:ie:nt:ma:ca:dr (oui Unknown)
	  Vendor-rfc1048 Extensions
	    Magic Cookie 0x12345678
	    Requested-IP (50), length 4: 1.2.3.4
	    DHCP-Message (53), length 1: Request
	    Parameter-Request (55), length 14:
	      Subnet-Mask (1), Classless-Static-Route (121), Default-Gateway (3), Domain-Name-Server (6)
	      Hostname (12), Domain-Name (15), MTU (26), BR (28)
	      Static-Route (33), NTP (42), Lease-Time (51), RN (58)
	      RB (59), Unknown (119)
	    MSZ (57), length 2: 1472
	    Hostname (12), length 4: "client"
02:55:26.812047 IP (tos 0xc0, ttl 64, id 57327, offset 0, flags [none], proto UDP (17), length 336)
    server.bootps > 1.2.3.4.bootpc: BOOTP/DHCP, Reply, length 308, xid 0x87654321, Flags [none]
	  Your-IP 1.2.3.4
	  Server-IP server
	  Client-Ethernet-Address cl:ie:nt:ma:ca:dr (oui Unknown)
	  Vendor-rfc1048 Extensions
	    Magic Cookie 0x12345678
	    DHCP-Message (53), length 1: ACK
	    Server-ID (54), length 4: server
	    Lease-Time (51), length 4: 131072
	    Subnet-Mask (1), length 4: 255.0.0.0
	    BR (28), length 4: 1.255.255.255
	    Default-Gateway (3), length 4: server
	    Domain-Name-Server (6), length 4: server
	    Domain-Name (15), length 5: "domain"
	    Hostname (12), length 4: "client"
```
..i.e., completely legitimate.

IOW, `dhcpcd` `10.0.3`, as per Nixpkgs `master` is completely broken in this use case.

### Steps To Reproduce
1. ```networking.interfaces.enp2s0f0.useDHCP = true;```

### Expected behavior
`dhcpcd` should acquire the DHCP lease from the server.

### Notify maintainers

@edolstra 

### Metadata

```console
 - system: `"x86_64-linux"`
 - host os: `Linux 6.6.11-hardened1, NixOS, 24.05 (Uakari), 24.05.git.2a7d0d9fe220`
 - multi-user?: `no`
 - sandbox: `yes`
 - version: `nix-env (Nix) 2.18.1`
 - nixpkgs: `/nix/var/nix/profiles/per-user/root/channels/nixos`
```

---

Add a :+1: [reaction] to [issues you find important].

[reaction]: https://github.blog/2016-03-10-add-reactions-to-pull-requests-issues-and-comments/
[issues you find important]: https://github.com/NixOS/nixpkgs/issues?q=is%3Aissue+is%3Aopen+sort%3Areactions-%2B1-desc

**Comment by deepfire** [comment]
cc @jiegec

**Comment by jiegec** [comment]
Could you test if the latest release of dhcpcd works?

**Comment by deepfire** [comment]
Turned out, the issue I have originally referred was unrelated -- filed a new one: https://github.com/NetworkConfiguration/dhcpcd/issues/291

**Comment by deepfire** [comment]
Trying out https://github.com/NixOS/nixpkgs/pull/284123 as a fix.

**Comment by yorickvP** [comment]
Hitting this on 24.05

**Comment by deepfire** [comment]
https://github.com/NixOS/nixpkgs/pull/284123 fixes this, through a bump to the latest release.

The fix is only halfway, though -- the `dhcpcd` bump allows the address to be acquired, but it's not necessarily what the server initially offers (go figure).

cc @yorickvP @jiegec
