### ISSUE TITLE
LXD containers not getting IPs

### ISSUE THREAD

**Issue by gesperon** [NixOS/nixpkgs#255110]
### Describe the bug
LXD containers fail to get IP addresses (dhcp).

At commit 347b5fb808805277b7797529d518a363fd8483e7 you could lunch a LXD container and get an IP. Ex:

```console
$ lxc launch ubuntu:22.04 u1
...

$ lxc list 
+---------------+---------+------+------+-----------+-----------+
|     NAME      |  STATE  | IPV4 | IPV6 |   TYPE    | SNAPSHOTS |
+---------------+---------+------+------+-----------+-----------+
| u1            | RUNNING | [someiphere] |      | CONTAINER | 0         |
+---------------+---------+------+------+-----------+-----------+
```

Sometime after it broke, containers aren't getting any IPs. Ex:

```console
$ lxc launch ubuntu:22.04 u1
...

$ lxc list 
+---------------+---------+------+------+-----------+-----------+
|     NAME      |  STATE  | IPV4 | IPV6 |   TYPE    | SNAPSHOTS |
+---------------+---------+------+------+-----------+-----------+
| u1            | RUNNING |      |      | CONTAINER | 0         |
+---------------+---------+------+------+-----------+-----------+
```

dnsmasq seems to be running:
```console
# ps -ef | grep dnsmasq
nobody      2931    2558  0 08:34 ?        00:00:00 dnsmasq --keep-in-foreground --strict-order --bind-interfaces --except-interface=lo --pid-file= --no-ping --interface=lxdbr0 --dhcp-rapid-commit --no-negcache --quiet-dhcp --quiet-dhcp6 --quiet-ra --listen-address=10.91.94.1 --dhcp-no-override --dhcp-authoritative --dhcp-leasefile=/var/lib/lxd/networks/lxdbr0/dnsmasq.leases --dhcp-hostsfile=/var/lib/lxd/networks/lxdbr0/dnsmasq.hosts --dhcp-range 10.91.94.2,10.91.94.254,1h -s lxd --interface-name _gateway.lxd,lxdbr0 -S /lxd/ --conf-file=/var/lib/lxd/networks/lxdbr0/dnsmasq.raw -u nobody -g lxd
```

but I don't see any DHCP response when starting the container (lxc start u1):
```console
# tcpdump -i any -n port 67 or port 68
tcpdump: data link type LINUX_SLL2
tcpdump: verbose output suppressed, use -v[v]... for full protocol decode
listening on any, link-type LINUX_SLL2 (Linux cooked v2), snapshot length 262144 bytes
08:44:27.837522 ?     Out IP 0.0.0.0.68 > 255.255.255.255.67: BOOTP/DHCP, Request from 00:16:3e:72:c5:f8, length 281
08:44:27.837524 ?     B   IP 0.0.0.0.68 > 255.255.255.255.67: BOOTP/DHCP, Request from 00:16:3e:72:c5:f8, length 281
08:44:28.904393 vethc4bce365 B   IP 0.0.0.0.68 > 255.255.255.255.67: BOOTP/DHCP, Request from 00:16:3e:72:c5:f8, length 286
08:44:28.904396 lxdbr0 B   IP 0.0.0.0.68 > 255.255.255.255.67: BOOTP/DHCP, Request from 00:16:3e:72:c5:f8, length 286
08:44:33.190706 vethc4bce365 B   IP 0.0.0.0.68 > 255.255.255.255.67: BOOTP/DHCP, Request from 00:16:3e:72:c5:f8, length 286
08:44:33.190706 lxdbr0 B   IP 0.0.0.0.68 > 255.255.255.255.67: BOOTP/DHCP, Request from 00:16:3e:72:c5:f8, length 286
08:44:37.713772 vethc4bce365 B   IP 0.0.0.0.68 > 255.255.255.255.67: BOOTP/DHCP, Request from 00:16:3e:72:c5:f8, length 286
08:44:37.713772 lxdbr0 B   IP 0.0.0.0.68 > 255.255.255.255.67: BOOTP/DHCP, Request from 00:16:3e:72:c5:f8, length 286
08:44:45.174265 vethc4bce365 B   IP 0.0.0.0.68 > 255.255.255.255.67: BOOTP/DHCP, Request from 00:16:3e:72:c5:f8, length 286
08:44:45.174265 lxdbr0 B   IP 0.0.0.0.68 > 255.255.255.255.67: BOOTP/DHCP, Request from 00:16:3e:72:c5:f8, length 286
08:45:00.262472 vethc4bce365 B   IP 0.0.0.0.68 > 255.255.255.255.67: BOOTP/DHCP, Request from 00:16:3e:72:c5:f8, length 286
08:45:00.262472 lxdbr0 B   IP 0.0.0.0.68 > 255.255.255.255.67: BOOTP/DHCP, Request from 00:16:3e:72:c5:f8, length 286
```

### Steps To Reproduce
1.  Launch a container:  lxc launch ubuntu:22.04 u1
2.  Check IP: lxc list

### Expected behavior
I expect dnsmasq to respond with and IP address from the DHCP pool and the LXD container to have it.

### Additional context
Relevant configuration:
```console
  virtualisation = {
    lxd = {
      enable = true;
      recommendedSysctlSettings = true;
    };
  };
```

### Metadata
```console
[user@system:~]$ nix-shell -p nix-info --run "nix-info -m"
 - system: `"x86_64-linux"`
 - host os: `Linux 6.4.15, NixOS, 23.11 (Tapir), 23.11.20230914.2f6fe7a`
 - multi-user?: `yes`
 - sandbox: `yes`
 - version: `nix-env (Nix) 2.17.0`
 - channels(root): `"home-manager, nixos, nixpkgs, sops-nix"`
 - nixpkgs: `/nix/var/nix/profiles/per-user/root/channels/nixos`
```

**Comment by gesperon** [comment]
.
