### ISSUE TITLE
jitsi-meet: Whiteboard synchronization issues

### ISSUE THREAD

**Issue by GGenken** [NixOS/nixpkgs#465784]
### Nixpkgs version

- Stable (25.05)

### Describe the bug

No whiteboard-related actions done by some meeting participant reach other participants.

### Steps to reproduce

1. Create a meeting room as moderator
2. Join the same meeting room as a guest user
3. As moderator, click "Show whiteboard"
4. Guest user has no indication of board being open
5. If guest user logs in as another moderator and clicks "Show whiteboard", they get ~30 "Couldn't decrypt data." subsequent in-browser alerts; after clicking through them, moderator who opened the board first also gets ~30 similar alerts; the cycle of alerts repeats with another user.

### Expected behaviour

Whiteboard is available for all participants

### Relevant log output

```console
● jitsi-videobridge2.service - Jitsi Videobridge
     Loaded: loaded (/etc/systemd/system/jitsi-videobridge2.service; enabled; preset: ignored)
     Active: active (running) since Fri 2025-11-28 02:37:01 MSK; 27min ago
 Invocation: 728f5924fa34482693b2cdceaeb30139
    Process: 2247 ExecStartPre=/run/current-system/sw/bin/sleep 5 (code=exited, status=0/SUCCESS)
   Main PID: 3819 (jitsi-videobrid)
         IP: 9.6M in, 2M out
         IO: 48.6M read, 17.6M written
      Tasks: 115 (limit: 65000)
     Memory: 694.3M (peak: 701.3M)
        CPU: 41.800s
     CGroup: /system.slice/jitsi-videobridge2.service
             ├─3819 /nix/store/l9k32vj2aczxw62134j1x0dsh569jz2l-bash-5.2p37/bin/bash /nix/store/r5qd221hfxg7g195b2ya0rc1ks6yx0i5-unit-script-jitsi-videobridge2-start/bin/jitsi-videobridge2-start
             └─3821 /nix/store/qi12aif612fl39yr9ms52wmw1wd91z7x-openjdk-headless-21.0.9+8/bin/java -Xmx3072m -XX:+UseG1GC -XX:+HeapDumpOnOutOfMemoryError -XX:HeapDumpPath=/tmp -Djdk.tls.ephemeralDHKeySize=2048 -Dconfig.file=/nix/store/aaxdca2i3ir4fwdaw1bs1rzzr5fa2k6g-jvb.conf -Djava.util.logging.config.file=/etc/jitsi/videobridge/logging.properties -Dlog4j2.formatMsgNoLookups=1 -Dnet.java.sip.communicator.SC_HOME_DIR_LOCATION=/etc/jitsi -Dnet.java.sip.communicator.SC_HOME_DIR_NAME=videobridge -Dorg.ice4j.ice.harvest.NAT_HARVESTER_LOCAL_ADDRESS=192.168.10.1 -Dorg.ice4j.ice.harvest.NAT_HARVESTER_PUBLIC_ADDRESS=1.2.3.4 -cp "/nix/store/qnnq4gxp0wh6hhs3l01nhdx8wxdwws5p-jitsi-videobridge2-2.3-220-g7cda0a66/share/jitsi-videobridge/jitsi-videobridge.jar:/nix/store/qnnq4gxp0wh6hhs3l01nhdx8wxdwws5p-jitsi-videobridge2-2.3-220-g7cda0a66/share/jitsi-videobridge/lib/*" org.jitsi.videobridge.MainKt

Nov 28 02:38:34 server jitsi-videobridge2-start[3821]: INFO: [105] Aes.createCipher#433: Will employ AES implemented by OpenSSL for AES/GCM/NoPadding.
Nov 28 02:38:34 server jitsi-videobridge2-start[3821]: INFO: [105] Aes.createCipher#433: Will employ AES implemented by OpenSSL for AES/CTR/NoPadding.
Nov 28 02:38:34 server jitsi-videobridge2-start[3821]: INFO: [85] [confId=fe8541859acfce8b conf_name=test2@conference.jitsi.example.com meeting_id=2ae9afc4] Conference.recentSpeakersChanged#467: Recent speakers changed: [9474f44b], dominant speaker changed: true silence:false
Nov 28 02:38:34 server jitsi-videobridge2-start[3821]: INFO: [103] PacketTransitStats.<clinit>#55: Initializing, jsonEnabled=true, prometheusEnabled=false, jitterEnabled=false
Nov 28 02:38:35 server jitsi-videobridge2-start[3821]: INFO: [103] [confId=fe8541859acfce8b conf_name=test2@conference.jitsi.example.com meeting_id=2ae9afc4 epId=915c45a2 stats_id=Gloria-5un] AllocationSettingsWrapper.setBandwidthAllocationSettings#141: Ignoring assumed-bandwidth-bps, not allowed in config.
Nov 28 02:38:35 server jitsi-videobridge2-start[3821]: INFO: [85] [confId=fe8541859acfce8b conf_name=test2@conference.jitsi.example.com meeting_id=2ae9afc4 epId=9474f44b stats_id=Russell-EBO] AllocationSettingsWrapper.setBandwidthAllocationSettings#141: Ignoring assumed-bandwidth-bps, not allowed in config.
Nov 28 02:38:37 server jitsi-videobridge2-start[3821]: INFO: [101] [confId=fe8541859acfce8b conf_name=test2@conference.jitsi.example.com meeting_id=2ae9afc4 epId=915c45a2 stats_id=Gloria-5un local_ufrag=1p31i1jb3qtknl ufrag=1p31i1jb3qtknl] Agent.setState#936: ICE state changed from Completed to Terminated.
Nov 28 02:38:37 server jitsi-videobridge2-start[3821]: INFO: [101] [confId=fe8541859acfce8b conf_name=test2@conference.jitsi.example.com meeting_id=2ae9afc4 epId=9474f44b stats_id=Russell-EBO local_ufrag=co8kc1jb3qtkfv ufrag=co8kc1jb3qtkfv] Agent.setState#936: ICE state changed from Completed to Terminated.
Nov 28 02:42:48 server jitsi-videobridge2-start[3821]: INFO: [103] [confId=fe8541859acfce8b conf_name=test2@conference.jitsi.example.com meeting_id=2ae9afc4] Conference.lambda$new$1#227: RECV colibri2 request: <iq xmlns="jabber:client" to="jvb@auth.jitsi.example.com/SLv3Wm_3E_KB" from="jvbbrewery@internal.auth.jitsi.example.com/focus" id="anZiQGF1dGguY2FsbC5nZW5rZW4uZGV2L1NMdjNXbV8zRV9LQgA1OEtRSi0xMgB/ai8YGVPRRg==" type="get"><conference-modify xmlns="jitsi:colibri2" meeting-id="2ae9afc4-3b0b-4359-83c8-0f311cae0762"><endpoint stats-id="Russell-EBO" id="9474f44b"><sources><media-source type="audio" id="9474f44b-a0"><source xmlns="urn:xmpp:jingle:apps:rtp:ssma:0" name="9474f44b-a0" ssrc="3494842990"/></media-source><media-source type="video" id="9474f44b-v0"><source>...
Nov 28 02:42:48 server jitsi-videobridge2-start[3821]: INFO: [103] [confId=fe8541859acfce8b conf_name=test2@conference.jitsi.example.com meeting_id=2ae9afc4] Conference.lambda$new$1#254: SENT colibri2 response: <iq xmlns='jabber:client' to='jvbbrewery@internal.auth.jitsi.example.com/focus' from='jvb@auth.jitsi.example.com/SLv3Wm_3E_KB' id='anZiQGF1dGguY2FsbC5nZW5rZW4uZGV2L1NMdjNXbV8zRV9LQgA1OEtRSi0xMgB/ai8YGVPRRg==' type='result'><conference-modified xmlns='jitsi:colibri2'><endpoint xmlns='jitsi:colibri2' id='9474f44b'/></conference-modified></iq>

● jitsi-excalidraw.service - Excalidraw collaboration backend for Jitsi
     Loaded: loaded (/etc/systemd/system/jitsi-excalidraw.service; enabled; preset: ignored)
     Active: active (running) since Fri 2025-11-28 02:36:56 MSK; 31min ago
 Invocation: 5fbe6640d74c4485bc8ca2eb8ad78af1
   Main PID: 2246 (node)
         IP: 314.7K in, 141.3K out
         IO: 63.2M read, 0B written
      Tasks: 11 (limit: 76668)
     Memory: 89.5M (peak: 90.5M)
        CPU: 1.393s
     CGroup: /system.slice/jitsi-excalidraw.service
             └─2246 /nix/store/xv1lykwi8n984ips4rpjv1imfwqpak31-nodejs-22.20.0/bin/node dist/index.js

Nov 28 02:36:56 prime systemd[1]: Started Excalidraw collaboration backend for Jitsi.

sh-5.2$ sudo tcpdump -ni any udp port 10000 # machine is capable of receiving connections at UDP 10000
...
03:12:18.281725 eno1  In  IP 192.168.10.2.58815 > 192.168.10.1.10000: UDP, length 71
03:12:18.291073 eno1  In  IP 192.168.10.2.58815 > 192.168.10.1.10000: UDP, length 100
03:12:18.291766 eno1  Out IP 192.168.10.1.10000 > 192.168.10.2.58815: UDP, length 108
03:12:18.303062 eno1  In  IP 192.168.10.2.58815 > 192.168.10.1.10000: UDP, length 71
03:12:18.324553 eno1  In  IP 192.168.10.2.58815 > 192.168.10.1.10000: UDP, length 71
03:12:18.346031 eno1  In  IP 192.168.10.2.58815 > 192.168.10.1.10000: UDP, length 71
03:12:18.367436 eno1  In  IP 192.168.10.2.58815 > 192.168.10.1.10000: UDP, length 71
03:12:18.378038 eno1  In  IP 192.168.10.2.58815 > 192.168.10.1.10000: UDP, length 71
03:12:18.389441 eno1  Out IP 192.168.10.1.10000 > 192.168.10.2.58815: UDP, length 52
03:12:18.399236 eno1  In  IP 192.168.10.2.58815 > 192.168.10.1.10000: UDP, length 71
03:12:18.420738 eno1  In  IP 192.168.10.2.58815 > 192.168.10.1.10000: UDP, length 71
03:12:18.442081 eno1  In  IP 192.168.10.2.58815 > 192.168.10.1.10000: UDP, length 71
03:12:18.463319 eno1  In  IP 192.168.10.2.58815 > 192.168.10.1.10000: UDP, length 71
03:12:18.485091 eno1  In  IP 192.168.10.2.58815 > 192.168.10.1.10000: UDP, length 71
03:12:18.506162 eno1  In  IP 192.168.10.2.58815 > 192.168.10.1.10000: UDP, length 71
03:12:18.527299 eno1  In  IP 192.168.10.2.58815 > 192.168.10.1.10000: UDP, length 71
03:12:18.538412 eno1  In  IP 192.168.10.2.58815 > 192.168.10.1.10000: UDP, length 71
03:12:18.553419 eno1  Out IP 192.168.10.1.10000 > 192.168.10.2.58815: UDP, length 120
03:12:18.554481 eno1  In  IP 192.168.10.2.58815 > 192.168.10.1.10000: UDP, length 64
03:12:18.559502 eno1  In  IP 192.168.10.2.58815 > 192.168.10.1.10000: UDP, length 71
03:12:18.580625 eno1  In  IP 192.168.10.2.58815 > 192.168.10.1.10000: UDP, length 71
...
```

### Additional context

Jitsi version in question is `jitsi-meet-1.0.8043` (as of current stable nixos-25.05)
Configuration piece directly related to Jitsi:
```
{ ... }:
let
  fqdn = "jitsi.example.com";
  port = 8500;
in
{
  services.jitsi-meet = {
    enable = true;
    hostName = fqdn;
    nginx.enable = true;
    secureDomain = {
      enable = true;
      authentication = "internal_hashed";
    };
    prosody.lockdown = true;
    config.prejoinPageEnabled = true;
    excalidraw.enable = true;
  };
  services.jitsi-videobridge = {
    openFirewall = true; # nothing seems to listen on TCP 4443
    nat = {
      localAddress = "192.168.10.1";
      publicAddress = "1.2.3.4";
    };
  };
  # even when after network-online.target, fails to bind for some reason; a delay to hack around boot race condition
  systemd.services.jitsi-videobridge2.serviceConfig.ExecStartPre = "/run/current-system/sw/bin/sleep 5";
  nixpkgs.config.permittedInsecurePackages = [ "jitsi-meet-1.0.8043" ]; # only Jitsi's E2EE affected by libolm's CVE
  services.prosody.extraModules = [ "jitsi_session" ]; # https://github.com/jitsi/jitsi-meet/issues/14001

  services.nginx.virtualHosts.${fqdn} = {
    listen = [{ addr = "127.0.0.1"; inherit port; }];
    enableACME = false;
    forceSSL = false;
  };

  custom.traefik.proxies = [
    {
      name = "jitsi";
      inherit fqdn port;
    }
  ];
}
```

Other features (audio & video feed, reactions, raising hand, chat, polls, screen sharing) work as expected.

My issue is similar to behavior described in https://github.com/jitsi/jitsi-meet/issues/14001 (also a NixOS installation). I added `jitsi_session` module in the config of Prosody (which was absent by default), and it did fix some other syncing issues, but not the whiteboard. `room_metadata` module was already present in the generated config.
The issue mentioned
>Also make sure the metadata component is set up and referenced as mentioned elsewhere.
...but I do not know what additional configuration is required here.

There are a lot of exceptions coming in the browser from excalidraw.production.min.js and a couple of others, but I'm not sure what's critical and relevant. Please let me know if you need any logs from there.

### System metadata

 - system: `"x86_64-linux"`
 - host os: `Linux 6.12.58, NixOS, 25.05 (Warbler), 25.05.20251124.1c8ba8d`
 - multi-user?: `yes`
 - sandbox: `yes`
 - version: `nix-env (Nix) 2.28.5`
 - nixpkgs: `/nix/store/79nihxkkd2gix5y4ijf0zmyznx04lghn-source`

### Notify maintainers

@novmar @ryantm @Lassulus @yayayayaka

---

**Note for maintainers:** Please tag this issue in your pull request description. (i.e. `Resolves #ISSUE`.)

### I assert that this issue is relevant for Nixpkgs

- [x] I assert that this is a bug and not a support request.
- [x] I assert that this is not a [duplicate of an existing issue](https://github.com/NixOS/nixpkgs/issues?q=is%3Aopen+is%3Aissue+label%3A%220.kind%3A+bug%22+-label%3A%226.topic%3A+darwin%22+-label%3A%226.topic%3A+nixos%22). 
- [x] I assert that I have read the [NixOS Code of Conduct](https://github.com/NixOS/.github/blob/master/CODE_OF_CONDUCT.md) and agree to abide by it.

### Is this issue important to you?

Add a :+1: [reaction] to [issues you find important].

[reaction]: https://github.blog/2016-03-10-add-reactions-to-pull-requests-issues-and-comments/
[issues you find important]: https://github.com/NixOS/nixpkgs/issues?q=is%3Aissue+is%3Aopen+sort%3Areactions-%2B1-desc

**Comment by inthesquarehole** [comment]
Start by configuring this on a system, which upstream claims to support, then to check whether it works using Nix packages, and only then to generate a working configuration (i.e., write/adapt a NixOS module).

**Comment by GGenken** [comment]
> Start by configuring this on a system, which upstream claims to support, then to check whether it works using Nix packages, and only then to generate a working configuration (i.e., write/adapt a NixOS module).

Unfortunately, I have only one NixOS machine capable of hosting Jitsi, hosting it elsewhere would be whole another setup. For now, I can't determine whether it's my misconfiguration, NixOS module issue, or a Jitsi upstream bug (hence the generic package bug report template).

**Comment by GGenken** [comment]
Tested similar setup with nixos-unstable (jitsi-meet 1.0.8792), bug seems to persist.
